"DESCRIPTION","DURATION IN MS","NAME","PARENT SUITE","START TIME","STATUS","STOP TIME","SUB SUITE","SUITE","TEST CLASS","TEST METHOD"
"","3326","Validar layout e componentes da tela principal","","2026-07-21","passed","2026-07-21","","Tela principal - Funcionários","",""
"","6521","Validar cadastro de funcionário com sucesso","","2026-07-21","passed","2026-07-21","","Cadastro de funcionário","",""
"","3484","Validar ação do botão ""Limpar filtros""","","2026-07-21","passed","2026-07-21","","Tela principal - Funcionários","",""
"","5995","Validar ação do botão ""Ver apenas ativos""","","2026-07-21","passed","2026-07-21","","Tela principal - Funcionários","",""
"","3063","Validar ação no botão ""+ Adicionar Funcionário""","","2026-07-21","passed","2026-07-21","","Tela principal - Funcionários","",""
